{
  "$schema": "../../../schemas/library-definitions.schema.json",
  "version": "1.0.0",
  "generatedAt": "2026-09-03",
  "workId": "fr-sr",
  "unitId": null,
  "unitNumber": null,
  "source": {
    "name": "Department of Personnel and Training — Compilation of Fundamental Rules and Supplementary Rules — English",
    "url": "https://dopt.gov.in/sites/default/files/Compilation_FR_SR_English_2.pdf"
  },
  "terms": []
}
