{
  "$schema": "../../../schemas/library-definitions.schema.json",
  "version": "1.0.0",
  "generatedAt": "2026-09-03",
  "workId": "ccs-pension",
  "unitId": "ccs-pension-3",
  "unitNumber": "3",
  "source": {
    "name": "Department of Pension and Pensioners' Welfare — CCS (Pension) Rules, 2021 — gazette notification, English",
    "url": "https://pensionersportal.gov.in/Document/CCS-Pension-Rules%202021-English.pdf"
  },
  "terms": []
}
