{
  "$schema": "../../../schemas/library-definitions.schema.json",
  "version": "1.0.0",
  "generatedAt": "2026-09-03",
  "workId": "csmop",
  "unitId": null,
  "unitNumber": null,
  "source": {
    "name": "Department of Administrative Reforms and Public Grievances — Central Secretariat Manual of Office Procedure, 2022 (16th edition) — English",
    "url": "https://www.darpg.gov.in/static/uploads/2025/10/774e0b8f427b7875158363d842fa431f.pdf"
  },
  "terms": []
}
